{
  "goal": "Confirm that the Research Pipeline’s Step 3 readiness can be justified from the provided local documentation and note any blockers for runtime verification.",
  "scope": "Local documentation covering the enhancement guide, README, base contract, schema, and policies governing the Planner/Retriever/Verifier/Synthesizer topology.",
  "allowed_tools": [],
  "summary": "Documented evidence from the enhancement guide and README shows the required Research Pipeline roles, structured JSON expectations, and local-only scope, while the base_contract, schema, memory_write_policy, and injection_boundary files collectively prove the prompt stack, schema enforcement, state_delta merging, and safety/fallback rules are in place; the only unresolved artifact is codex-global-multi-agent/does-not-exist.md, so further runtime validation must wait for that input.",
  "evidence": [
    {
      "type": "file",
      "value": "/Users/zyh/Desktop/ceshi123/ollamashiyong/Codex全局增强方案-候选清单.md: Step 3 demands a Research Pipeline run with Planner/Retriever/Verifier/Synthesizer agents, structured JSON outputs (goal/scope/evidence/state_delta/next_steps/fallback), and the referenced topology/docs."
    },
    {
      "type": "file",
      "value": "/Users/zyh/Desktop/ceshi123/ollamashiyong/codex-global-multi-agent/README.md: The Research Pipeline checklist reinforces the need for schema-compliant JSON, merged state_delta, fallback_suggestion handling, and forbids unauthorized memory writes within the documented local scope."
    },
    {
      "type": "file",
      "value": "/Users/zyh/Desktop/ceshi123/ollamashiyong/codex-global-multi-agent/prompts/shared/base_contract.md: Defines the five-layer prompt stack, Retriever/Verifier/Synthesizer role structure, JSON-only output rules, recovery/fallback behavior, and context safety limitations every subagent must obey."
    },
    {
      "type": "file",
      "value": "/Users/zyh/Desktop/ceshi123/ollamashiyong/codex-global-multi-agent/schemas/subagent_contract.schema.json: Enforces the required goal/scope/allowed_tools/summary/evidence/state_delta/risks/fallback/next_steps/confidence fields, typed evidence entries, and limited fallback enum values."
    },
    {
      "type": "file",
      "value": "/Users/zyh/Desktop/ceshi123/ollamashiyong/codex-global-multi-agent/policies/memory_write_policy.md: Prohibits child agents from persisting long-term memory or global configs, delegating state_delta reconciliation to the main agent."
    },
    {
      "type": "file",
      "value": "/Users/zyh/Desktop/ceshi123/ollamashiyong/codex-global-multi-agent/policies/injection_boundary.md: Requires treating external content as data, staying within allowed tools/contexts, lowering confidence when evidence is missing, and surfacing risks/next_steps rather than overreaching."
    },
    {
      "type": "command",
      "value": "cat /Users/zyh/Desktop/ceshi123/ollamashiyong/codex-global-multi-agent/does-not-exist.md -> No such file or directory: The requested artifact for additional validation is absent, so the documentation review cannot cover it until it exists."
    }
  ],
  "state_delta": {
    "facts": [
      "Research Pipeline must produce schema-validated JSON with structured fields (goal/scope/evidence/state_delta/next_steps/fallback) while remaining within the locally documented artifacts.",
      "Planner/Retriever/Verifier/Synthesizer topology plus the prompt stack/base contract guarantee separation of concerns, JSON-only output, fallback guidance, and safety constraints expected by Step 3.",
      "Memory_write_policy and injection_boundary outline that child agents can only report state_delta evidence and must flag gaps or risks instead of writing persistent memory, preserving entropy control.",
      "The missing codex-global-multi-agent/does-not-exist.md artifact blocks verifying any additional requirements tied to that file until it is provided."
    ],
    "preferences": [
      "Evidence should remain anchored in the supplied local documents and respect the schema/backbone contract rather than speculative runtime data.",
      "Structured JSON outputs should always note missing proof via risks/fallbacks instead of fabricating confidence."
    ],
    "decisions": [
      "Maintain JSON-only reporting per the schema and channel unresolved artifacts (like the missing file) into risks, next_steps, and fallback_suggestion rather than guessing."
    ],
    "risks": [
      "Without executing the pipeline, no runtime assurance is possible, so any integration issues remain theoretical.",
      "The absence of codex-global-multi-agent/does-not-exist.md prevents a full dossier; progress halts until the artifact is supplied."
    ]
  },
  "risks": [
    "Verification is purely documentary, so undisclosed runtime constraints could still surface later.",
    "State_delta merging has no runtime test harness yet, meaning integration mismatches may emerge once the pipeline actually runs.",
    "Missing codex-global-multi-agent/does-not-exist.md leaves a documentation gap that blocks comprehensive coverage."
  ],
  "fallback_suggestion": "request_human_input",
  "next_steps": [
    "Provide codex-global-multi-agent/does-not-exist.md or confirm the correct artifact path so the Research Pipeline verification can incorporate that evidence.",
    "Once all artifacts are present, have the main agent run the Research Pipeline against these documents and validate the JSON outputs/state_delta merging to gain runtime assurance.",
    "If the missing file remains unavailable, flag which acceptance criteria are still unverified due to the gap and revisit once the user supplies a substitute."
  ],
  "confidence": 0.68
}
