{
  "goal": "Document the evidence that Step 3’s Research Pipeline has executable foundations by extracting the acceptance criteria, required topology, and runtime scope from the local artifacts.",
  "scope": "Extract the acceptance criteria, execution topology, and runtime constraints for the Research Pipeline from the three specified local files.",
  "allowed_tools": [
    "exec_command"
  ],
  "summary": "Step 3 requires running a Research Pipeline composed of Planner/Retriever/Verifier/Synthesizer agents that produce the prescribed structured JSON with fallback guidance, interface contracts, and state_delta consolidation, all within the constrained local-only execution scope defined by the research_pipeline_input.",
  "evidence": [
    {
      "type": "file",
      "value": "/Users/zyh/Desktop/ceshi123/ollamashiyong/Codex全局增强方案-候选清单.md: Step 3 acceptance criteria demand a Research Pipeline run, structured JSON output with goal/scope/evidence/fallback, interface separation across four MCP/skill/orchestration layers, and the Planner/Retriever/Verifier/Synthesizer roles within that topology."
    },
    {
      "type": "file",
      "value": "/Users/zyh/Desktop/ceshi123/ollamashiyong/codex-global-multi-agent/README.md: The Research Pipeline acceptance checklist reiterates the need for at least one successful run, valid structured JSON, merged state_delta, and fallback_suggestion, plus constraints forbidding direct memory writes and requiring JSON validation."
    },
    {
      "type": "file",
      "value": "/Users/zyh/Desktop/ceshi123/ollamashiyong/codex-global-multi-agent/examples/research_pipeline_input.json: The runtime scope is limited to local artifacts; the task goal is to confirm executable foundations for Step 3, and the expected checks mirror the Research Pipeline acceptance criteria."
    }
  ],
  "state_delta": {
    "facts": [
      "Research Pipeline must run Planner/Retriever/Verifier/Synthesizer agents and output schema-enforced JSON with goal/scope/evidence/state_delta/next_steps/fallback fields.",
      "Structured JSON must survive schema validation and include fallback_suggestion for failure cases while respecting memory/write boundaries.",
      "Runtime scope confines the execution to local documents and artifacts listed in the research_pipeline_input, preventing external network access."
    ],
    "preferences": [
      "Favor local document artifacts as the sole evidence sources when proving Step 3 readiness.",
      "Emphasize schema-backed outputs and interface contracts to demonstrate executable grounding."
    ],
    "decisions": [
      "Use the provided README and enhancement guide to establish acceptance criteria and topology requirements without modifying files.",
      "Rely on the research_pipeline_input to define runtime scope and expected checks for validation."
    ],
    "risks": [
      "No runtime execution data is present, so the conclusion is based purely on documentation references."
    ]
  },
  "risks": [
    "Evidence is entirely documentary; there is no real execution trace to confirm the Research Pipeline has already run."
  ],
  "fallback_suggestion": null,
  "next_steps": [
    "Share these curated acceptance criteria with the main agent so it can orchestrate an actual Research Pipeline execution against the documented topology.",
    "If additional runtime confirmation is needed, request the main agent to run validate_and_merge.py with the Research Pipeline JSON outputs and report results."
  ],
  "confidence": 0.64
}
